{
  "schema_version": 1,
  "producer_command": "manual checked-in product-source artifact",
  "contract_version": "phase23.8.6f-v1",
  "policy_id": "self-hosting-procedure-execution-policy",
  "procedures": [
    {
      "procedure_id": "feature-decomposition",
      "canonical_contract_ref": "skills/self-hosting/feature-decomposition/SKILL.md",
      "semantic_class": "semantic_required",
      "deterministic_prechecks": ["active_task_identity", "roadmap_authority", "scope_non_goals"],
      "semantic_residual": ["coherent_task_boundaries", "dependency_order"],
      "minimum_route": "balanced_routine",
      "escalation_triggers": ["architecture", "authority", "conflicting_evidence"],
      "independence": "same_role",
      "context_transport": "packet_plus_retrieval",
      "automatic_launch": false,
      "deterministic_completion_supported": false,
      "required_output_contract": ["task_proposals", "dependency_order", "open_questions"],
      "required_evidence_contract": ["task_contract_refs", "roadmap_refs"]
    },
    {
      "procedure_id": "task-intake",
      "canonical_contract_ref": "skills/self-hosting/task-intake/SKILL.md",
      "semantic_class": "semantic_required",
      "deterministic_prechecks": ["task_pointer", "active_task_readable", "acceptance_present"],
      "semantic_residual": ["ambiguity", "scope_contradiction"],
      "minimum_route": "balanced_routine",
      "escalation_triggers": ["authority", "lifecycle", "conflicting_evidence"],
      "independence": "same_role",
      "context_transport": "fresh_packet",
      "automatic_launch": false,
      "deterministic_completion_supported": false,
      "required_output_contract": ["normalized_contract", "scope", "non_goals", "blockers"],
      "required_evidence_contract": ["task_pointer_ref", "task_contract_ref", "acceptance_refs"]
    },
    {
      "procedure_id": "task-prompt-writer",
      "canonical_contract_ref": "skills/self-hosting/task-prompt-writer/SKILL.md",
      "semantic_class": "semantic_optional",
      "deterministic_prechecks": ["task_contract_identity", "procedure_contract_identity", "required_reading"],
      "semantic_residual": ["instruction_clarity"],
      "minimum_route": "balanced_routine",
      "escalation_triggers": ["authority", "security"],
      "independence": "same_role",
      "context_transport": "fresh_packet",
      "automatic_launch": false,
      "deterministic_completion_supported": true,
      "required_output_contract": ["invocation_ready_prompt", "constraints", "validation"],
      "required_evidence_contract": ["task_contract_ref", "procedure_contract_ref"]
    },
    {
      "procedure_id": "draft-plan",
      "canonical_contract_ref": "skills/self-hosting/draft-plan/SKILL.md",
      "semantic_class": "semantic_required",
      "deterministic_prechecks": ["intake_artifact", "task_identity", "repo_status", "allowed_scope"],
      "semantic_residual": ["implementation_sequence", "tradeoffs", "stop_conditions"],
      "minimum_route": "complex_judgment",
      "escalation_triggers": ["architecture", "authority", "storage", "security"],
      "independence": "same_role",
      "context_transport": "packet_plus_retrieval",
      "automatic_launch": false,
      "deterministic_completion_supported": false,
      "required_output_contract": ["scope", "steps", "validation", "risks"],
      "required_evidence_contract": ["intake_artifact_ref", "source_refs", "acceptance_refs"]
    },
    {
      "procedure_id": "plan-review",
      "canonical_contract_ref": "skills/self-hosting/plan-review/SKILL.md",
      "semantic_class": "semantic_required",
      "deterministic_prechecks": ["exact_plan_identity", "task_identity", "required_sections", "review_independence"],
      "semantic_residual": ["architecture_scope", "lifecycle_authority", "storage_runtime", "cost_context_routing"],
      "minimum_route": "complex_judgment",
      "escalation_triggers": ["architecture", "authority", "lifecycle", "storage", "security", "conflicting_evidence"],
      "independence": "independent",
      "context_transport": "fresh_independent_delta",
      "automatic_launch": true,
      "deterministic_completion_supported": false,
      "required_output_contract": ["review_surface", "review_tier", "findings", "policy_controls", "durable_decision", "recommendation", "verdict"],
      "required_evidence_contract": ["exact_plan_ref", "task_ref", "source_refs", "review_tier_lenses"],
      "direct_artifact_required": true,
      "nested_review_launch_forbidden": true
    },
    {
      "procedure_id": "plan-amend",
      "canonical_contract_ref": "skills/self-hosting/plan-amend/SKILL.md",
      "semantic_class": "semantic_required",
      "deterministic_prechecks": ["review_artifact_identity", "finding_inventory", "plan_identity"],
      "semantic_residual": ["finding_disposition", "effective_plan_consistency"],
      "minimum_route": "complex_judgment",
      "escalation_triggers": ["architecture", "authority", "lifecycle", "storage"],
      "independence": "same_role",
      "context_transport": "resume_same_role",
      "automatic_launch": false,
      "deterministic_completion_supported": false,
      "required_output_contract": ["finding_disposition", "effective_scope", "effective_steps", "validation", "risks"],
      "required_evidence_contract": ["prior_plan_ref", "review_ref", "finding_refs"]
    },
    {
      "procedure_id": "architecture-review",
      "canonical_contract_ref": "skills/self-hosting/architecture-review/SKILL.md",
      "semantic_class": "semantic_required",
      "deterministic_prechecks": ["task_identity", "plan_identity", "changed_surface_inventory"],
      "semantic_residual": ["boundary_consistency", "dependency_direction"],
      "minimum_route": "critical_independent",
      "escalation_triggers": ["architecture", "authority", "security"],
      "independence": "independent",
      "context_transport": "fresh_packet",
      "automatic_launch": false,
      "deterministic_completion_supported": false,
      "required_output_contract": ["findings", "boundary_verdict", "next_action"],
      "required_evidence_contract": ["diff_refs", "architecture_refs", "plan_ref"]
    },
    {
      "procedure_id": "db-storage-review",
      "canonical_contract_ref": "skills/self-hosting/db-storage-review/SKILL.md",
      "semantic_class": "semantic_required",
      "deterministic_prechecks": ["schema_inventory", "migration_inventory", "round_trip_results"],
      "semantic_residual": ["durability", "migration_safety", "identity_isolation"],
      "minimum_route": "critical_independent",
      "escalation_triggers": ["storage", "migration", "corruption", "authority"],
      "independence": "independent",
      "context_transport": "packet_plus_retrieval",
      "automatic_launch": false,
      "deterministic_completion_supported": false,
      "required_output_contract": ["storage_findings", "migration_verdict", "recovery_notes"],
      "required_evidence_contract": ["schema_refs", "test_refs", "storage_trace_refs"]
    },
    {
      "procedure_id": "implementation-review",
      "canonical_contract_ref": "skills/self-hosting/implementation-review/SKILL.md",
      "semantic_class": "semantic_required",
      "deterministic_prechecks": ["approved_plan_identity", "source_diff_identity", "verification_results", "review_independence"],
      "semantic_residual": ["architecture_scope", "lifecycle_authority", "storage_runtime", "cost_context_routing"],
      "minimum_route": "balanced_routine",
      "escalation_triggers": ["architecture", "authority", "lifecycle", "storage", "security", "conflicting_evidence"],
      "independence": "independent",
      "context_transport": "fresh_independent_delta",
      "automatic_launch": true,
      "deterministic_completion_supported": false,
      "required_output_contract": ["review_surface", "findings", "four_lens_verdicts", "durable_decision", "recommendation", "verdict"],
      "required_evidence_contract": ["approved_plan_ref", "diff_ref", "verification_refs", "source_identity"],
      "direct_artifact_required": true,
      "nested_review_launch_forbidden": true
    },
    {
      "procedure_id": "fix-pass-review",
      "canonical_contract_ref": "skills/self-hosting/fix-pass-review/SKILL.md",
      "semantic_class": "semantic_required",
      "deterministic_prechecks": ["prior_findings", "fix_diff_identity", "new_verification_results"],
      "semantic_residual": ["finding_closure", "touched_surface_regressions"],
      "minimum_route": "balanced_routine",
      "escalation_triggers": ["new_blocker", "authority", "lifecycle", "storage", "security", "reviewer_disagreement"],
      "independence": "independent",
      "context_transport": "fresh_independent_delta",
      "automatic_launch": false,
      "deterministic_completion_supported": false,
      "required_output_contract": ["finding_dispositions", "regressions", "verdict", "next_action"],
      "required_evidence_contract": ["prior_review_ref", "delta_ref", "verification_refs"]
    },
    {
      "procedure_id": "verification-review",
      "canonical_contract_ref": "skills/self-hosting/verification-review/SKILL.md",
      "semantic_class": "semantic_optional",
      "deterministic_prechecks": ["required_command_inventory", "command_results", "snapshot_identity"],
      "semantic_residual": ["evidence_adequacy"],
      "minimum_route": "deterministic_no_model",
      "escalation_triggers": ["conflicting_evidence", "missing_required_check"],
      "independence": "independent",
      "context_transport": "fresh_packet",
      "automatic_launch": false,
      "deterministic_completion_supported": true,
      "required_output_contract": ["command_matrix", "evidence_gaps", "verdict"],
      "required_evidence_contract": ["command_result_refs", "snapshot_ref", "exact_run_identity"]
    },
    {
      "procedure_id": "delivery-facts-review",